<?xml version="1.0" encoding="UTF-8"?>
<system xmlns:xsi="http://www.w3.org/2001/XMLSchema-instance"
 xsi:schemaLocation="https://raw.github.com/pgunia/SemanticBuildingModeler_Ressources/master/Schema/System https://raw.github.com/pgunia/SemanticBuildingModeler_Ressources/master/Schema/System/SystemSchema.xsd"
 xmlns="https://raw.github.com/pgunia/SemanticBuildingModeler_Ressources/master/Schema/System">
    <applicationWindow>
        <width>1300</width>
        <height>1000</height>
    </applicationWindow>
    <cityConfiguration>
        <!-- <configFolder>C:\\Users\Patrick\Dropbox\Promotion\\XML-Konfigurationen</configFolder> -->
        <configFolder>/Users/Patrick/Dropbox/Promotion/XML-Konfigurationen</configFolder>
        <configFile>CityExample.xml</configFile>
    </cityConfiguration>
    <textures>
        <supportedTextureCategories>Wall,Roof,Ground,Test</supportedTextureCategories>
        <maxTextureSize>256</maxTextureSize>
        <maxTextureScaleFactor>1</maxTextureScaleFactor>

        <!-- WINDOWS -->
        <texturePath>C:\\Users\Patrick\Dropbox\Promotion\\Models\\SystemTextures</texturePath>
    </textures>
    
    <importModels>
        <supportedModelCategories>Window,Door,Pillar_Dorisch,Pillar_Ionisch,Triglyphe,Portal,Moulding_Gotisch,Moulding_Eckstein,Window_Jugendstil,Ledge</supportedModelCategories>
        <!-- WINDOWS -->
        <modelPath>C:\\Users\Patrick\Dropbox\Promotion\\Models\\SystemModels</modelPath>
    </importModels>
    
    <exportModels>
        <exportFolder>"ressource/Export/"</exportFolder>
        <exportFile>ModelExport2</exportFile>
    </exportModels>
</system>
